{
  "id": "mara_the_long_way",
  "label": "s32_st_mara_the_long_way",
  "title": "The Long Way",
  "category": "conversation",
  "status": "prototype",
  "characters": [
    "mara"
  ],
  "location": "town_road",
  "time_slots": [
    "afternoon",
    "evening"
  ],
  "tags": [
    "slice_of_life",
    "character",
    "friendship"
  ],
  "priority": 40,
  "weight": 1.3,
  "requirements": [
    "rel mara->player.familiarity >= 6"
  ],
  "effects": [
    "rel mara->player.familiarity += 3"
  ],
  "outcomes": [
    [
      "trait gentle += 1",
      "rel player->mara.trust += 6",
      "rel mara->player.trust += 4"
    ],
    [
      "trait curious += 1",
      "rel player->mara.respect += 6",
      "know(june_arrived_alone, mara_mentioned_it)"
    ],
    [
      "trait reserved += 1",
      "rel player->mara.respect += 3",
      "rel mara->player.familiarity += 2"
    ]
  ],
  "cooldown": 0,
  "repeat_policy": "once",
  "summary": "Mara's non-mystery scene, required by the Act 1 rule that every central character has one. She walks the player back the long way for no stated reason. A dog, a gate, and how long it takes to stop being new somewhere. Moves player->mara, which almost nothing else does: this is where the player's own view of her changes, and later scenes read it."
}
