{
  "id": "common_room_three_way",
  "label": "s32_st_common_room_three_way",
  "title": "The Rota, Continued",
  "category": "conversation",
  "status": "draft",
  "characters": [
    "june",
    "mara",
    "theo"
  ],
  "location": "common_room",
  "time_slots": [
    "evening"
  ],
  "tags": [
    "slice_of_life",
    "friendship",
    "character"
  ],
  "priority": 40,
  "weight": 1.3,
  "requirements": [
    "anchor_done(the_common_room)",
    "seen(common_room_kettle)"
  ],
  "effects": [
    "rel june->player.familiarity += 1",
    "rel mara->player.familiarity += 1"
  ],
  "outcomes": [
    [
      "trait direct += 1",
      "rel june->player.trust += 3",
      "rel mara->june.resentment += 3",
      "rel theo->june.respect += 2"
    ],
    [
      "trait gentle += 1",
      "rel mara->player.trust += 4",
      "rel june->mara.familiarity += 2",
      "rel theo->mara.respect += 3"
    ],
    [
      "trait reserved += 1",
      "rel theo->player.respect += 3",
      "rel june->player.respect += 2",
      "rel mara->player.respect += 2"
    ]
  ],
  "cooldown": 0,
  "repeat_policy": "once",
  "summary": "Group scene. June, Mara and Theo disagree about the kitchen rota, and the disagreement is not about the kitchen rota. The player cannot fix it and is not asked to; what they can do is decide whose account of it they accept, which moves edges they are not on."
}
